{
  "$schema": "https://json-schema.org/draft/2020-12/schema",
  "$id": "https://example.org/mcp-cortex/belief_claim.schema.json",
  "title": "BeliefClaim",
  "type": "object",
  "required": ["id", "claim", "confidence", "evidence", "publisher", "counterevidence", "review_status", "validity"],
  "properties": {
    "id": { "type": "string", "pattern": "^belief://" },
    "claim": { "type": "string" },
    "confidence": { "type": "number", "minimum": 0, "maximum": 1 },
    "evidence": { "type": "array", "items": { "type": "string" } },
    "publisher": { "type": "string" },
    "counterevidence": { "type": "array", "items": { "type": "string" } },
    "review_status": { "type": "string" },
    "validity": { "type": "object" }
  },
  "additionalProperties": false
}
